<?xml version="1.0" encoding="UTF-8"?>
<!-- 
1 Crear un document en XML vàlid amb la informació d’un únic contacte.
1.2 Modela como a mínim la següent informació:
o Nom, cognoms
o telèfon fix, telèfon mòbil
1.3 Modifica el document afegir la següent informació:
o Edat
o direcció (carrer, codi postal, ciutat)
o direcció de email
1.4 Modifica el document per que pugui emmagatzemar 2 contactes.
1.5 Afegeix un atribut que ens indiqui si un contacte es un familiar o no, i si una direcció es el
domicili principal o no
-->

<llibreta_contactes xmlns:xsi="http://www.w3.org/2001/XMLSchema-instance"
xsi:noNamespaceSchemaLocation="project.xsd">
<contacto es_familiar = 'no'>
    <nombre> ROGER </nombre>
    <apellidos> SERRATS VICENTE </apellidos>
    <edad mallor = "si"> 18 </edad>
    <dirección domicilio = "principal">
        <calle> C/ RUBIÓ I BALAGUER</calle>
        
        <cod_postal> 08035 </cod_postal>
        <ciudad> BARCELONA </ciudad>
    </dirección>
    <dir_email> serri@gmail.com </dir_email>
    <telefons>
        <fix>   987 67 67 67</fix>
        <móvil> 611 47 19 77 </móvil>
    </telefons>
</contacto>
<contacto es_familiar = 'no'>
    <nombre> PAU </nombre>
    <apellidos> HERNANDEZ SADURNÍ </apellidos>
    <edad mallor = "si"> 18 </edad>
    <dirección domicilio = "secundario">
        <calle> CARRETERA DEL PRAT </calle>
        <num_calle> 46 </num_calle>
        <cod_postal> 08038 </cod_postal>
        <ciudad> BARCELONA </ciudad>
    </dirección>
    <dir_email> pauhernandezsadurni@gmail.com </dir_email>
    <telefons>
        <fix> 644 89 79 69 </fix>
        <móvil> 644 68 67 46</móvil>
    </telefons>
</contacto>
</llibreta_contactes>